{
  "$schema": "https://json-schema.org/draft/2020-12/schema",
  "additionalProperties": false,
  "allOf": [
    {
      "if": {
        "properties": {
          "effects": {
            "properties": {
              "d2d": {
                "const": false
              }
            }
          }
        }
      },
      "then": {
        "properties": {
          "arrays": {
            "const": 1
          }
        }
      }
    },
    {
      "if": {
        "properties": {
          "effects": {
            "properties": {
              "retention": {
                "const": false
              }
            }
          }
        }
      },
      "then": {
        "properties": {
          "years": {
            "const": [
              0
            ]
          }
        }
      }
    },
    {
      "else": {
        "properties": {
          "hardware": {
            "additionalProperties": false,
            "properties": {
              "adc_bits": {
                "const": null
              },
              "adc_order": {
                "const": null
              },
              "preset_id": {
                "const": null
              },
              "range_policy": {
                "const": null
              },
              "tile_size": {
                "enum": [
                  64,
                  128,
                  256
                ]
              }
            },
            "required": [
              "tile_size",
              "adc_bits",
              "adc_order",
              "range_policy",
              "preset_id"
            ],
            "type": "object"
          }
        }
      },
      "if": {
        "properties": {
          "effects": {
            "properties": {
              "adc": {
                "const": true
              }
            }
          }
        }
      },
      "then": {
        "properties": {
          "hardware": {
            "additionalProperties": false,
            "properties": {
              "adc_bits": {
                "enum": [
                  3,
                  4,
                  5,
                  6,
                  7,
                  8
                ]
              },
              "adc_order": {
                "enum": [
                  "subtract_then_adc",
                  "adc_then_subtract"
                ]
              },
              "preset_id": {
                "const": null
              },
              "range_policy": {
                "const": "validation_max_abs"
              },
              "tile_size": {
                "enum": [
                  64,
                  128,
                  256
                ]
              }
            },
            "required": [
              "tile_size",
              "adc_bits",
              "adc_order",
              "range_policy",
              "preset_id"
            ],
            "type": "object"
          }
        }
      }
    },
    {
      "description": "1.2.0 keeps exactly its original meaning: C2C is unavailable and every record is a single write. Only a 1.3.0 request may turn C2C on or reprogram more than once.",
      "if": {
        "properties": {
          "schema_version": {
            "const": "1.2.0"
          }
        }
      },
      "then": {
        "properties": {
          "effects": {
            "properties": {
              "c2c": {
                "const": false
              }
            }
          },
          "n_reprogram": {
            "const": 1
          }
        }
      }
    },
    {
      "description": "C2C on: every referenced profile revision must state its own manual relative CV -- never inherited or copied from another profile in the same request.",
      "if": {
        "properties": {
          "effects": {
            "properties": {
              "c2c": {
                "const": true
              }
            }
          }
        }
      },
      "then": {
        "properties": {
          "profile_refs": {
            "items": {
              "required": [
                "id",
                "revision",
                "c2c"
              ]
            }
          }
        }
      }
    },
    {
      "description": "C2C off: no profile_refs entry may carry manual C2C data (it must not look pre-filled), and a single write is required.",
      "if": {
        "properties": {
          "effects": {
            "properties": {
              "c2c": {
                "const": false
              }
            }
          }
        }
      },
      "then": {
        "properties": {
          "n_reprogram": {
            "const": 1
          },
          "profile_refs": {
            "items": {
              "not": {
                "required": [
                  "c2c"
                ]
              }
            }
          }
        }
      }
    },
    {
      "description": "Measured C2C exists only in 1.4.0; 1.2.0 and 1.3.0 keep their exact meaning (manual assumption only).",
      "if": {
        "properties": {
          "schema_version": {
            "enum": [
              "1.2.0",
              "1.3.0"
            ]
          }
        }
      },
      "then": {
        "properties": {
          "profile_refs": {
            "items": {
              "properties": {
                "c2c": {
                  "properties": {
                    "source": {
                      "const": "manual_assumption"
                    }
                  }
                }
              }
            }
          }
        }
      }
    },
    {
      "description": "PPA exists only in 1.4.0 and only with the ADC on; 1.2.0 and 1.3.0 keep engines.ppa=off.",
      "if": {
        "properties": {
          "schema_version": {
            "enum": [
              "1.2.0",
              "1.3.0"
            ]
          }
        }
      },
      "then": {
        "properties": {
          "engines": {
            "properties": {
              "ppa": {
                "const": "off"
              }
            }
          }
        }
      }
    },
    {
      "description": "assumed_proxy PPA prices a converter, so the ADC must be on.",
      "if": {
        "properties": {
          "engines": {
            "properties": {
              "ppa": {
                "const": "assumed_proxy"
              }
            },
            "required": [
              "ppa"
            ]
          }
        },
        "required": [
          "engines"
        ]
      },
      "then": {
        "properties": {
          "effects": {
            "properties": {
              "adc": {
                "const": true
              }
            }
          }
        }
      }
    }
  ],
  "description": "Validated request shape; server must also enforce published profile/data/engine capabilities and run budget. No measured device fields may be overridden. v1.1.0 requests are not reinterpreted: tile_size is now explicit with the ADC off and adc_order is required, so a 1.1.0 request is rejected with an explicit migration error. v1.2.0 requests keep their original meaning (C2C unavailable, single write). v1.3.0 adds an optional manual-assumption C2C model per docs/completion-plan-2026-09-21.md P2: relative CV in percent per referenced profile revision, plus 1-100 reprogram iterations; off (the default reading of a 1.2.0 request) is unchanged.",
  "properties": {
    "arrays": {
      "maximum": 100,
      "minimum": 1,
      "type": "integer"
    },
    "checkpoint_id": {
      "format": "uuid",
      "type": [
        "string",
        "null"
      ]
    },
    "effects": {
      "additionalProperties": false,
      "properties": {
        "adc": {
          "type": "boolean"
        },
        "c2c": {
          "type": "boolean"
        },
        "d2d": {
          "type": "boolean"
        },
        "retention": {
          "type": "boolean"
        }
      },
      "required": [
        "d2d",
        "retention",
        "adc",
        "c2c"
      ],
      "type": "object"
    },
    "engines": {
      "additionalProperties": false,
      "properties": {
        "accuracy": {
          "enum": [
            "torch_reference",
            "aihwkit_ideal"
          ]
        },
        "ppa": {
          "description": "off (default) or assumed_proxy: NeuroSim conditional cost of a virtual analog circuit that uses the measured conductances (docs/spec/08). Schema 1.4.0 only, ADC on. Not a CTFM chip result; validated_for_ctfm stays false.",
          "enum": [
            "off",
            "assumed_proxy"
          ]
        }
      },
      "required": [
        "accuracy",
        "ppa"
      ],
      "type": "object"
    },
    "hardware": {
      "additionalProperties": false,
      "properties": {
        "adc_bits": {
          "enum": [
            null,
            3,
            4,
            5,
            6,
            7,
            8
          ]
        },
        "adc_order": {
          "enum": [
            null,
            "subtract_then_adc",
            "adc_then_subtract"
          ]
        },
        "preset_id": {
          "const": null
        },
        "range_policy": {
          "enum": [
            null,
            "validation_max_abs"
          ]
        },
        "tile_size": {
          "enum": [
            64,
            128,
            256
          ]
        }
      },
      "required": [
        "tile_size",
        "adc_bits",
        "adc_order",
        "range_policy",
        "preset_id"
      ],
      "type": "object"
    },
    "mappings": {
      "items": {
        "enum": [
          "fixed_reference",
          "pair_search"
        ]
      },
      "maxItems": 2,
      "minItems": 1,
      "type": "array",
      "uniqueItems": true
    },
    "model_id": {
      "const": "mnist_mlp_v1"
    },
    "n_reprogram": {
      "maximum": 100,
      "minimum": 1,
      "type": "integer"
    },
    "pools": {
      "items": {
        "enum": [
          "combined",
          "ltp",
          "ltd",
          "common"
        ]
      },
      "maxItems": 4,
      "minItems": 1,
      "type": "array",
      "uniqueItems": true
    },
    "profile_refs": {
      "items": {
        "additionalProperties": false,
        "properties": {
          "d2d": {
            "additionalProperties": false,
            "description": "Manual engineering assumption (not a measured CTFM distribution): relative CV as a percent, converted to a ratio exactly once at this boundary (ctfm.simulation.math.c2c_relative_cv_percent_to_ratio, reused for D2D). Optional -- absent means fall back to the profile's own measured D2D (if any).",
            "properties": {
              "cv_percent": {
                "minimum": 0,
                "type": "number"
              },
              "source": {
                "const": "manual_assumption"
              }
            },
            "required": [
              "cv_percent",
              "source"
            ],
            "type": "object"
          },
          "c2c": {
            "description": "Manual assumption (1.3.0/1.4.0) or measured detrended Program deviation (1.4.0 only). Never inherited between profiles.",
            "oneOf": [
              {
                "additionalProperties": false,
                "description": "Manual engineering assumption (not a measured CTFM distribution): relative CV as a percent, converted to a ratio exactly once at this boundary (ctfm.simulation.math.c2c_relative_cv_percent_to_ratio).",
                "properties": {
                  "cv_percent": {
                    "minimum": 0,
                    "type": "number"
                  },
                  "source": {
                    "const": "manual_assumption"
                  }
                },
                "required": [
                  "cv_percent",
                  "source"
                ],
                "type": "object"
              },
              {
                "additionalProperties": false,
                "description": "Measured C2C (schema 1.4.0 only): the server resolves analysis_id (a succeeded c2c_detrended analysis) and fills cv_percent and provenance from the stored Program result. A client may only name the analysis and state the two acknowledgements; it cannot supply the number. cv_percent/provenance are server-written fields.",
                "properties": {
                  "analysis_id": {
                    "format": "uuid",
                    "type": "string"
                  },
                  "approved_assumption": {
                    "const": true,
                    "description": "The user confirmed applying the Program relative deviation to every selected LTP/LTD state and both planes."
                  },
                  "cross_condition_acknowledged": {
                    "description": "Must be true when the analysis condition_id differs from the profile condition_id.",
                    "type": "boolean"
                  },
                  "cv_percent": {
                    "description": "Server-written; equals provenance.program_relative_std_percent.",
                    "minimum": 0,
                    "type": "number"
                  },
                  "provenance": {
                    "description": "Server-written pin of the analysis (id, file/result hashes, version, method, cycles, conditions, warnings).",
                    "type": "object"
                  },
                  "source": {
                    "const": "measured_detrended"
                  }
                },
                "required": [
                  "source",
                  "analysis_id",
                  "approved_assumption"
                ],
                "type": "object"
              }
            ]
          },
          "id": {
            "format": "uuid",
            "type": "string"
          },
          "revision": {
            "minimum": 1,
            "type": "integer"
          }
        },
        "required": [
          "id",
          "revision"
        ],
        "type": "object"
      },
      "minItems": 1,
      "type": "array",
      "uniqueItems": true
    },
    "schema_version": {
      "enum": [
        "1.2.0",
        "1.3.0",
        "1.4.0"
      ]
    },
    "seed": {
      "maximum": 4294967295,
      "minimum": 0,
      "type": "integer"
    },
    "years": {
      "contains": {
        "const": 0
      },
      "items": {
        "maximum": 100,
        "minimum": 0,
        "type": "number"
      },
      "maxItems": 10,
      "minItems": 1,
      "type": "array",
      "uniqueItems": true
    }
  },
  "required": [
    "schema_version",
    "profile_refs",
    "model_id",
    "checkpoint_id",
    "pools",
    "mappings",
    "effects",
    "arrays",
    "n_reprogram",
    "years",
    "seed",
    "hardware",
    "engines"
  ],
  "title": "CTFM first-release experiment request v1.2.0/v1.3.0",
  "type": "object"
}
