{
  "schema_version": "1.3.0",
  "profile_refs": [
    {
      "id": "11111111-1111-4111-8111-111111111111",
      "revision": 1,
      "c2c": {
        "cv_percent": 5,
        "source": "manual_assumption"
      }
    }
  ],
  "model_id": "mnist_mlp_v1",
  "checkpoint_id": null,
  "pools": [
    "combined"
  ],
  "mappings": [
    "fixed_reference"
  ],
  "effects": {
    "d2d": true,
    "retention": false,
    "adc": false,
    "c2c": true
  },
  "arrays": 3,
  "n_reprogram": 2,
  "years": [
    0
  ],
  "seed": 20260917,
  "hardware": {
    "tile_size": 64,
    "adc_bits": null,
    "range_policy": null,
    "preset_id": null,
    "adc_order": null
  },
  "engines": {
    "accuracy": "torch_reference",
    "ppa": "off"
  }
}
